{"$schema":"https://json-schema.org/draft/2020-12/schema","$id":"https://check.invalid/schemas/fixtures.schema.json","title":"CHECK V1 Semantic Fixture","type":"object","additionalProperties":false,"required":["fixture_id","domain","risk_tags","requirement_source_files","artifact_files","supplemental_files","expectations"],"properties":{"fixture_id":{"type":"string","minLength":1},"domain":{"enum":["cv-job","essay-rubric","proposal-brief","software-acceptance","report-deliverables","eligibility","policy","adversarial"]},"risk_tags":{"type":"array","items":{"type":"string","minLength":1},"uniqueItems":true},"requirement_source_files":{"type":"array","minItems":1,"items":{"type":"string","minLength":1}},"artifact_files":{"type":"array","minItems":1,"items":{"type":"string","minLength":1}},"supplemental_files":{"type":"array","items":{"type":"string","minLength":1}},"expectations":{"$ref":"#/$defs/expectations"}},"$defs":{"nullable_number":{"type":["number","null"],"minimum":0,"maximum":1},"criterion":{"type":"object","additionalProperties":false,"required":["expectation_id","source_excerpt","normalized_requirement","strength","verdict","evidence_excerpt"],"properties":{"expectation_id":{"type":"string","minLength":1},"source_excerpt":{"type":"string","minLength":1},"normalized_requirement":{"type":"string","minLength":1},"strength":{"enum":["REQUIRED","PREFERRED","CONDITIONAL","UNSPECIFIED"]},"verdict":{"enum":["MET","PARTIAL","MISSING","CONTRADICTED","UNVERIFIABLE"]},"evidence_excerpt":{"type":["string","null"]},"evidence_strength":{"enum":["DIRECT","INFERRED","RELATED"]},"interpretation_state":{"enum":["CLEAR","AMBIGUOUS"]},"applicability":{"enum":["APPLIES","DOES_NOT_APPLY","APPLICABILITY_UNKNOWN","NOT_CONDITIONAL"]},"aggregation_status":{"enum":["AGGREGATION_OK","OVERLAP_DETECTED","AGGREGATION_AMBIGUOUS","AGGREGATION_CONFLICT"]},"documentary_only":{"type":"boolean"}}},"expression":{"type":"object","additionalProperties":false,"required":["expectation_id","operator","member_expectation_ids","verdict"],"properties":{"expectation_id":{"type":"string","minLength":1},"operator":{"enum":["SINGLE","ALL_OF","ANY_OF","AT_LEAST_N_OF"]},"member_expectation_ids":{"type":"array","minItems":1,"items":{"type":"string","minLength":1}},"minimum_satisfied":{"type":["integer","null"],"minimum":1},"verdict":{"enum":["MET","PARTIAL","MISSING","CONTRADICTED","UNVERIFIABLE"]}}},"integrity":{"type":"object","additionalProperties":false,"required":["severity","category","description_contains"],"properties":{"severity":{"enum":["INFO","WARNING","ERROR"]},"category":{"enum":["CONTRADICTORY_FACTS","IMPOSSIBLE_VALUE","DUPLICATE_CONFLICT","TEMPORAL_CONFLICT","AGGREGATION_CONFLICT","OTHER"]},"description_contains":{"type":"string","minLength":1}}},"score_behavior":{"type":"object","additionalProperties":false,"required":["required_coverage","preferred_coverage","score_should_be_withheld"],"properties":{"required_coverage":{"$ref":"#/$defs/nullable_number"},"preferred_coverage":{"$ref":"#/$defs/nullable_number"},"score_should_be_withheld":{"type":"boolean"}}},"expectations":{"type":"object","additionalProperties":false,"required":["criteria","expressions","integrity_findings","source_conflict_expected","forbidden_requirements","score_behavior"],"properties":{"criteria":{"type":"array","items":{"$ref":"#/$defs/criterion"}},"expressions":{"type":"array","items":{"$ref":"#/$defs/expression"}},"integrity_findings":{"type":"array","items":{"$ref":"#/$defs/integrity"}},"source_conflict_expected":{"type":"boolean"},"forbidden_requirements":{"type":"array","items":{"type":"string","minLength":1},"uniqueItems":true},"expected_criterion_count":{"type":["integer","null"],"minimum":0},"limitations_contain":{"type":"array","items":{"type":"string","minLength":1}},"score_behavior":{"$ref":"#/$defs/score_behavior"}}}}}