{"fixture_id":"eligibility-basic-001","domain":"eligibility","risk_tags":["conditional-applicability","eligibility"],"requirement_source_files":["requirements.txt"],"artifact_files":["artifact.txt"],"supplemental_files":[],"expectations":{"criteria":[{"expectation_id":"EXP-001","source_excerpt":"must be at least 18 years old","normalized_requirement":"age >= 18","strength":"REQUIRED","verdict":"MET","evidence_excerpt":"Applicant age: 24.","evidence_strength":"DIRECT","interpretation_state":"CLEAR","applicability":"NOT_CONDITIONAL"},{"expectation_id":"EXP-002","source_excerpt":"If the programme requires travel, applicants must hold a valid passport.","normalized_requirement":"valid passport if travel required","strength":"CONDITIONAL","verdict":"UNVERIFIABLE","evidence_excerpt":null,"interpretation_state":"CLEAR","applicability":"DOES_NOT_APPLY"}],"expressions":[],"integrity_findings":[],"source_conflict_expected":false,"forbidden_requirements":[],"expected_criterion_count":null,"limitations_contain":[],"score_behavior":{"required_coverage":1.0,"preferred_coverage":null,"score_should_be_withheld":false}}}