{"fixture_id":"documentary-vs-reality-001","domain":"adversarial","risk_tags":["documentary-vs-reality"],"requirement_source_files":["requirements.txt"],"artifact_files":["artifact.txt"],"supplemental_files":[],"expectations":{"criteria":[{"expectation_id":"EXP-001","source_excerpt":"AWS Certified Solutions Architect certification.","normalized_requirement":"AWS Certified Solutions Architect certification","strength":"REQUIRED","verdict":"MET","evidence_excerpt":"Certifications: AWS Certified Solutions Architect — Associate.","evidence_strength":"DIRECT","interpretation_state":"CLEAR","applicability":"NOT_CONDITIONAL","documentary_only":true}],"expressions":[],"integrity_findings":[],"source_conflict_expected":false,"forbidden_requirements":[],"expected_criterion_count":null,"limitations_contain":[],"score_behavior":{"required_coverage":1.0,"preferred_coverage":null,"score_should_be_withheld":false}}}