{"fixture_id":"false-absence-001","domain":"adversarial","risk_tags":["false-absence"],"requirement_source_files":["requirements.txt"],"artifact_files":["artifact.txt"],"supplemental_files":[],"expectations":{"criteria":[{"expectation_id":"EXP-001","source_excerpt":"must not contain the applicant name anywhere","normalized_requirement":"applicant name absent","strength":"REQUIRED","verdict":"UNVERIFIABLE","evidence_excerpt":null,"interpretation_state":"CLEAR","applicability":"NOT_CONDITIONAL"}],"expressions":[],"integrity_findings":[],"source_conflict_expected":false,"forbidden_requirements":[],"expected_criterion_count":null,"limitations_contain":["Page 2 extraction failed"],"score_behavior":{"required_coverage":null,"preferred_coverage":null,"score_should_be_withheld":true}}}