{"fixture_id":"conditional-applicability-001","domain":"adversarial","risk_tags":["conditional-applicability"],"requirement_source_files":["requirements.txt"],"artifact_files":["artifact.txt"],"supplemental_files":[],"expectations":{"criteria":[{"expectation_id":"EXP-001","source_excerpt":"If travel is required, a valid driver licence is mandatory.","normalized_requirement":"valid driver licence if travel required","strength":"CONDITIONAL","verdict":"UNVERIFIABLE","evidence_excerpt":null,"interpretation_state":"CLEAR","applicability":"DOES_NOT_APPLY"}],"expressions":[],"integrity_findings":[],"source_conflict_expected":false,"forbidden_requirements":[],"expected_criterion_count":null,"limitations_contain":[],"score_behavior":{"required_coverage":null,"preferred_coverage":null,"score_should_be_withheld":true}}}