{"fixture_id":"overlap-double-counting-001","domain":"adversarial","risk_tags":["overlap-double-counting"],"requirement_source_files":["requirements.txt"],"artifact_files":["artifact.txt"],"supplemental_files":[],"expectations":{"criteria":[{"expectation_id":"EXP-001","source_excerpt":"At least three years of customer support experience.","normalized_requirement":"3+ years customer support experience","strength":"REQUIRED","verdict":"MET","evidence_excerpt":"Support Analyst: January 2021 to December 2022.\nSupport Engineer: January 2022 to December 2023.","evidence_strength":"INFERRED","interpretation_state":"CLEAR","applicability":"NOT_CONDITIONAL","aggregation_status":"OVERLAP_DETECTED"}],"expressions":[],"integrity_findings":[],"source_conflict_expected":false,"forbidden_requirements":[],"expected_criterion_count":null,"limitations_contain":[],"score_behavior":{"required_coverage":1.0,"preferred_coverage":null,"score_should_be_withheld":false}}}