{"fixture_id":"logical-or-corruption-001","domain":"adversarial","risk_tags":["logical-or-corruption"],"requirement_source_files":["requirements.txt"],"artifact_files":["artifact.txt"],"supplemental_files":[],"expectations":{"criteria":[{"expectation_id":"EXP-AWS","source_excerpt":"AWS or Azure","normalized_requirement":"AWS experience","strength":"REQUIRED","verdict":"MISSING","evidence_excerpt":null,"interpretation_state":"CLEAR","applicability":"NOT_CONDITIONAL"},{"expectation_id":"EXP-AZURE","source_excerpt":"AWS or Azure","normalized_requirement":"Azure experience","strength":"REQUIRED","verdict":"MET","evidence_excerpt":"Cloud platforms: Azure.","evidence_strength":"DIRECT","interpretation_state":"CLEAR","applicability":"NOT_CONDITIONAL"}],"expressions":[{"expectation_id":"EXP-OR","operator":"ANY_OF","member_expectation_ids":["EXP-AWS","EXP-AZURE"],"minimum_satisfied":null,"verdict":"MET"}],"integrity_findings":[],"source_conflict_expected":false,"forbidden_requirements":[],"expected_criterion_count":null,"limitations_contain":[],"score_behavior":{"required_coverage":1.0,"preferred_coverage":null,"score_should_be_withheld":false}}}