{"fixture_id":"artifact-integrity-001","domain":"adversarial","risk_tags":["artifact-integrity"],"requirement_source_files":["requirements.txt"],"artifact_files":["artifact.txt"],"supplemental_files":[],"expectations":{"criteria":[{"expectation_id":"EXP-001","source_excerpt":"At least two years of support experience.","normalized_requirement":"2+ years support experience","strength":"REQUIRED","verdict":"UNVERIFIABLE","evidence_excerpt":"Support Engineer: January 2025 to December 2023.","evidence_strength":"RELATED","interpretation_state":"CLEAR","applicability":"NOT_CONDITIONAL"}],"expressions":[],"integrity_findings":[{"severity":"ERROR","category":"TEMPORAL_CONFLICT","description_contains":"end date precedes start date"}],"source_conflict_expected":false,"forbidden_requirements":[],"expected_criterion_count":null,"limitations_contain":[],"score_behavior":{"required_coverage":null,"preferred_coverage":null,"score_should_be_withheld":true}}}