{"fixture_id":"report-deliverables-basic-001","domain":"report-deliverables","risk_tags":["quantitative-threshold","verdict"],"requirement_source_files":["requirements.txt"],"artifact_files":["artifact.txt"],"supplemental_files":[],"expectations":{"criteria":[{"expectation_id":"EXP-001","source_excerpt":"contain an executive summary","normalized_requirement":"executive summary present","strength":"REQUIRED","verdict":"MET","evidence_excerpt":"Executive summary: Customer response time improved during the pilot.","evidence_strength":"DIRECT","interpretation_state":"CLEAR","applicability":"NOT_CONDITIONAL"},{"expectation_id":"EXP-002","source_excerpt":"exactly three recommendations","normalized_requirement":"recommendation count = 3","strength":"REQUIRED","verdict":"MET","evidence_excerpt":"1. Extend the pilot.\n2. Add escalation templates.\n3. Measure first-contact resolution.","evidence_strength":"DIRECT","interpretation_state":"CLEAR","applicability":"NOT_CONDITIONAL"}],"expressions":[],"integrity_findings":[],"source_conflict_expected":false,"forbidden_requirements":[],"expected_criterion_count":null,"limitations_contain":[],"score_behavior":{"required_coverage":1.0,"preferred_coverage":null,"score_should_be_withheld":false}}}