{"fixture_id":"essay-rubric-basic-001","domain":"essay-rubric","risk_tags":["quantitative-threshold","verdict"],"requirement_source_files":["requirements.txt"],"artifact_files":["artifact.txt"],"supplemental_files":[],"expectations":{"criteria":[{"expectation_id":"EXP-001","source_excerpt":"must state a clear thesis","normalized_requirement":"clear thesis present","strength":"REQUIRED","verdict":"MET","evidence_excerpt":"Thesis: Remote work can improve retention when teams use deliberate communication practices.","evidence_strength":"DIRECT","interpretation_state":"CLEAR","applicability":"NOT_CONDITIONAL"},{"expectation_id":"EXP-002","source_excerpt":"cite at least two scholarly sources","normalized_requirement":">= 2 scholarly sources","strength":"REQUIRED","verdict":"MET","evidence_excerpt":"Sources: Smith (2024); Naidoo (2025).","evidence_strength":"DIRECT","interpretation_state":"CLEAR","applicability":"NOT_CONDITIONAL"},{"expectation_id":"EXP-003","source_excerpt":"Maximum length: 1,000 words.","normalized_requirement":"word count <= 1000","strength":"REQUIRED","verdict":"MET","evidence_excerpt":"Word count: 820.","evidence_strength":"DIRECT","interpretation_state":"CLEAR","applicability":"NOT_CONDITIONAL"}],"expressions":[],"integrity_findings":[],"source_conflict_expected":false,"forbidden_requirements":[],"expected_criterion_count":null,"limitations_contain":[],"score_behavior":{"required_coverage":1.0,"preferred_coverage":null,"score_should_be_withheld":false}}}