{"fixture_id":"source-conflict-001","domain":"adversarial","risk_tags":["source-conflict"],"requirement_source_files":["requirements.txt"],"artifact_files":["artifact.txt"],"supplemental_files":[],"expectations":{"criteria":[{"expectation_id":"EXP-001","source_excerpt":"Minimum three years of support experience.","normalized_requirement":"support experience threshold","strength":"REQUIRED","verdict":"UNVERIFIABLE","evidence_excerpt":"Support Engineer: 2022 to 2026 (four years).","evidence_strength":"INFERRED","interpretation_state":"CLEAR","applicability":"NOT_CONDITIONAL"}],"expressions":[],"integrity_findings":[],"source_conflict_expected":true,"forbidden_requirements":[],"expected_criterion_count":null,"limitations_contain":[],"score_behavior":{"required_coverage":null,"preferred_coverage":null,"score_should_be_withheld":true}}}