{"fixture_id":"plausibility-trap-001","domain":"adversarial","risk_tags":["plausibility-trap"],"requirement_source_files":["requirements.txt"],"artifact_files":["artifact.txt"],"supplemental_files":[],"expectations":{"criteria":[{"expectation_id":"EXP-001","source_excerpt":"Experience handling customer escalations.","normalized_requirement":"customer escalation handling experience","strength":"REQUIRED","verdict":"PARTIAL","evidence_excerpt":"Senior Support Engineer, 2022 to present.","evidence_strength":"RELATED","interpretation_state":"CLEAR","applicability":"NOT_CONDITIONAL"}],"expressions":[],"integrity_findings":[],"source_conflict_expected":false,"forbidden_requirements":[],"expected_criterion_count":null,"limitations_contain":[],"score_behavior":{"required_coverage":0.5,"preferred_coverage":null,"score_should_be_withheld":false}}}