{"fixture_id":"goalpost-expansion-001","domain":"adversarial","risk_tags":["goalpost-expansion"],"requirement_source_files":["requirements.txt"],"artifact_files":["artifact.txt"],"supplemental_files":[],"expectations":{"criteria":[{"expectation_id":"EXP-001","source_excerpt":"Python programming experience","normalized_requirement":"Python programming experience","strength":"REQUIRED","verdict":"MET","evidence_excerpt":"Skills: Python, SQL.","evidence_strength":"DIRECT","interpretation_state":"CLEAR","applicability":"NOT_CONDITIONAL"}],"expressions":[],"integrity_findings":[],"source_conflict_expected":false,"forbidden_requirements":["Git experience","Docker experience"],"expected_criterion_count":1,"limitations_contain":[],"score_behavior":{"required_coverage":1.0,"preferred_coverage":null,"score_should_be_withheld":false}}}