{"fixture_id":"policy-basic-001","domain":"policy","risk_tags":["prohibition","proof-of-absence"],"requirement_source_files":["requirements.txt"],"artifact_files":["artifact.txt"],"supplemental_files":[],"expectations":{"criteria":[{"expectation_id":"EXP-001","source_excerpt":"must not contain a South African ID number","normalized_requirement":"South African ID number absent","strength":"REQUIRED","verdict":"MET","evidence_excerpt":"No personal identifiers are included.","evidence_strength":"DIRECT","interpretation_state":"CLEAR","applicability":"NOT_CONDITIONAL"}],"expressions":[],"integrity_findings":[],"source_conflict_expected":false,"forbidden_requirements":[],"expected_criterion_count":null,"limitations_contain":[],"score_behavior":{"required_coverage":1.0,"preferred_coverage":null,"score_should_be_withheld":false}}}