{"fixture_id":"duplicate-requirement-inflation-001","domain":"adversarial","risk_tags":["duplicate-requirement-inflation"],"requirement_source_files":["requirements.txt"],"artifact_files":["artifact.txt"],"supplemental_files":[],"expectations":{"criteria":[{"expectation_id":"EXP-001","source_excerpt":"three years in customer support","normalized_requirement":"3+ years customer support experience","strength":"REQUIRED","verdict":"MET","evidence_excerpt":"Customer Support Engineer: 2021 to 2025.","evidence_strength":"INFERRED","interpretation_state":"CLEAR","applicability":"NOT_CONDITIONAL"}],"expressions":[],"integrity_findings":[],"source_conflict_expected":false,"forbidden_requirements":[],"expected_criterion_count":1,"limitations_contain":[],"score_behavior":{"required_coverage":1.0,"preferred_coverage":null,"score_should_be_withheld":false}}}