{"fixture_id":"cv-job-basic-001","domain":"cv-job","risk_tags":["requirement-extraction","verdict"],"requirement_source_files":["requirements.txt"],"artifact_files":["artifact.txt"],"supplemental_files":[],"expectations":{"criteria":[{"expectation_id":"EXP-001","source_excerpt":"At least three years of customer support experience.","normalized_requirement":"3+ years customer support experience","strength":"REQUIRED","verdict":"MET","evidence_excerpt":"Customer Support Engineer, January 2021 to January 2025.","evidence_strength":"INFERRED","interpretation_state":"CLEAR","applicability":"NOT_CONDITIONAL"},{"expectation_id":"EXP-002","source_excerpt":"Experience with Zendesk.","normalized_requirement":"Zendesk experience","strength":"PREFERRED","verdict":"MET","evidence_excerpt":"Skills: Zendesk.","evidence_strength":"DIRECT","interpretation_state":"CLEAR","applicability":"NOT_CONDITIONAL"}],"expressions":[],"integrity_findings":[],"source_conflict_expected":false,"forbidden_requirements":[],"expected_criterion_count":null,"limitations_contain":[],"score_behavior":{"required_coverage":1.0,"preferred_coverage":1.0,"score_should_be_withheld":false}}}