{"fixture_id":"software-acceptance-basic-001","domain":"software-acceptance","risk_tags":["software-acceptance","verdict"],"requirement_source_files":["requirements.txt"],"artifact_files":["artifact.txt"],"supplemental_files":[],"expectations":{"criteria":[{"expectation_id":"EXP-001","source_excerpt":"exits with code 0 for valid input","normalized_requirement":"valid input exits 0","strength":"REQUIRED","verdict":"MET","evidence_excerpt":"valid input smoke test: exit code 0.","evidence_strength":"DIRECT","interpretation_state":"CLEAR","applicability":"NOT_CONDITIONAL"},{"expectation_id":"EXP-002","source_excerpt":"rejects an empty project name with a clear error","normalized_requirement":"empty project name rejected with clear error","strength":"REQUIRED","verdict":"MET","evidence_excerpt":"empty project name test: rejected with \"project name must not be empty\".","evidence_strength":"DIRECT","interpretation_state":"CLEAR","applicability":"NOT_CONDITIONAL"}],"expressions":[],"integrity_findings":[],"source_conflict_expected":false,"forbidden_requirements":[],"expected_criterion_count":null,"limitations_contain":[],"score_behavior":{"required_coverage":1.0,"preferred_coverage":null,"score_should_be_withheld":false}}}