{"fixture_id":"incomplete-extraction-as-missing-001","domain":"adversarial","risk_tags":["incomplete-extraction-as-missing"],"requirement_source_files":["requirements.txt"],"artifact_files":["artifact.txt"],"supplemental_files":[],"expectations":{"criteria":[{"expectation_id":"EXP-001","source_excerpt":"Valid driver licence.","normalized_requirement":"valid driver licence","strength":"REQUIRED","verdict":"UNVERIFIABLE","evidence_excerpt":null,"interpretation_state":"CLEAR","applicability":"NOT_CONDITIONAL"}],"expressions":[],"integrity_findings":[],"source_conflict_expected":false,"forbidden_requirements":[],"expected_criterion_count":null,"limitations_contain":["Page 2 could not be extracted"],"score_behavior":{"required_coverage":null,"preferred_coverage":null,"score_should_be_withheld":true}}}