{"fixture_id":"ambiguity-invention-001","domain":"adversarial","risk_tags":["ambiguity-invention"],"requirement_source_files":["requirements.txt"],"artifact_files":["artifact.txt"],"supplemental_files":[],"expectations":{"criteria":[{"expectation_id":"EXP-001","source_excerpt":"Strong industry experience.","normalized_requirement":"strong industry experience","strength":"REQUIRED","verdict":"UNVERIFIABLE","evidence_excerpt":"Industry Analyst: 2024 to 2026.","evidence_strength":"RELATED","interpretation_state":"AMBIGUOUS","applicability":"NOT_CONDITIONAL"}],"expressions":[],"integrity_findings":[],"source_conflict_expected":false,"forbidden_requirements":[],"expected_criterion_count":null,"limitations_contain":[],"score_behavior":{"required_coverage":null,"preferred_coverage":null,"score_should_be_withheld":true}}}