{"fixture_id":"proposal-brief-basic-001","domain":"proposal-brief","risk_tags":["quantitative-threshold","verdict"],"requirement_source_files":["requirements.txt"],"artifact_files":["artifact.txt"],"supplemental_files":[],"expectations":{"criteria":[{"expectation_id":"EXP-001","source_excerpt":"include a delivery timeline","normalized_requirement":"delivery timeline present","strength":"REQUIRED","verdict":"MET","evidence_excerpt":"Delivery timeline: discovery in September; pilot in October.","evidence_strength":"DIRECT","interpretation_state":"CLEAR","applicability":"NOT_CONDITIONAL"},{"expectation_id":"EXP-002","source_excerpt":"include a budget","normalized_requirement":"budget present","strength":"REQUIRED","verdict":"MET","evidence_excerpt":"Budget: R95,000.","evidence_strength":"DIRECT","interpretation_state":"CLEAR","applicability":"NOT_CONDITIONAL"},{"expectation_id":"EXP-003","source_excerpt":"budget must not exceed R100,000","normalized_requirement":"budget <= R100000","strength":"REQUIRED","verdict":"MET","evidence_excerpt":"Budget: R95,000.","evidence_strength":"DIRECT","interpretation_state":"CLEAR","applicability":"NOT_CONDITIONAL"}],"expressions":[],"integrity_findings":[],"source_conflict_expected":false,"forbidden_requirements":[],"expected_criterion_count":null,"limitations_contain":[],"score_behavior":{"required_coverage":1.0,"preferred_coverage":null,"score_should_be_withheld":false}}}